{"type":"config","name":"parseff-oxcaml","metricName":"json_fused","metricUnit":"parses/sec","bestDirection":"higher"}
{"run":1,"commit":"b9da14f","metric":4735745,"metrics":{"json_generic":862467,"csv_fused":3586093,"csv_generic":1522893,"arith_fused":6588917,"arith_generic":685836},"status":"keep","description":"baseline: -O3 -unbox-closures","timestamp":1774371701,"segment":0}
{"run":2,"commit":"3c3a45c","metric":4935103,"metrics":{"json_generic":878723,"csv_fused":3672892,"csv_generic":1545607,"arith_fused":8046994,"arith_generic":712370},"status":"keep","description":"-unbox-closures-factor 20: +4.2% json_fused","timestamp":1774371758,"segment":0}
{"run":3,"commit":"3c3a45c","metric":4676940,"metrics":{"json_generic":850930,"csv_fused":3562713,"csv_generic":1543484,"arith_fused":7831774,"arith_generic":643569},"status":"discard","description":"-inline 100: regression, excessive inlining hurts code cache","timestamp":1774371787,"segment":0}
{"run":4,"commit":"3c3a45c","metric":4902201,"metrics":{"json_generic":890726,"csv_fused":3611021,"csv_generic":1584246,"arith_fused":7744734,"arith_generic":720085},"status":"discard","description":"-rounds 3: no improvement over -unbox-closures-factor 20 alone","timestamp":1774371819,"segment":0}
{"run":5,"commit":"3c3a45c","metric":4748676,"metrics":{"json_generic":878472,"csv_fused":3719200,"csv_generic":1548251,"arith_fused":7330303,"arith_generic":669860},"status":"discard","description":"-Oclassic: worse than -O3 across fused benchmarks","timestamp":1774371846,"segment":0}
{"run":6,"commit":"3c3a45c","metric":4874007,"metrics":{"json_generic":860374,"csv_fused":3379691,"csv_generic":1506909,"arith_fused":8218277,"arith_generic":718148},"status":"discard","description":"-O2: slightly worse json_fused, better arith_fused but primary metric regressed","timestamp":1774371873,"segment":0}
{"run":7,"commit":"3c3a45c","metric":4915937,"metrics":{"json_generic":916179,"csv_fused":3780647,"csv_generic":1563758,"arith_fused":7597918,"arith_generic":712911},"status":"discard","description":"-inline 20: within noise of best, no clear improvement","timestamp":1774371900,"segment":0}
{"run":8,"commit":"no-efx","metric":7346729,"metrics":{"json_generic":1398856,"csv_fused":4107114,"csv_generic":2275365,"arith_fused":18326766,"arith_generic":1264974},"status":"discard","description":"INFO: no-effects branch (explore/no-effects) baseline - 49% faster json_fused, 128% faster arith_fused. Effects overhead is ~50-130%.","timestamp":1774372803,"segment":0}
{"run":9,"commit":"no-efx","metric":7307004,"metrics":{"json_generic":1448792,"csv_fused":4252243,"csv_generic":2211924,"arith_fused":18894662,"arith_generic":1266039},"status":"discard","description":"INFO: no-effects + unbox-closures-factor 20: no significant change vs plain -O3","timestamp":1774372829,"segment":0}
{"run":10,"commit":"95fc85b","metric":5037910,"metrics":{"json_generic":886081,"csv_fused":3414834,"csv_generic":1541093,"arith_fused":8060941,"arith_generic":687089},"status":"keep","description":"Remove Fun.protect from run_deep/run_deep_source: +2.1% json_fused","timestamp":1774372879,"segment":0}
{"run":11,"commit":"95fc85b","metric":4426737,"metrics":{"json_generic":859465,"csv_fused":3536381,"csv_generic":1633680,"arith_fused":7865345,"arith_generic":707812},"status":"discard","description":"Unrolled scan_while 2x: much worse (-12%) on short inputs, branch overhead dominates","timestamp":1774372965,"segment":0}
{"run":12,"commit":"95fc85b","metric":3448752,"metrics":{"json_generic":787290,"csv_fused":2799630,"csv_generic":1394020,"arith_fused":7280405,"arith_generic":653379},"status":"discard","description":"Recursive scan_while: much worse (-32%), while+ref is faster than tail recursion for this pattern","timestamp":1774372990,"segment":0}
{"run":13,"commit":"8623200","metric":5098529,"metrics":{"json_generic":929865,"csv_fused":3606138,"csv_generic":1617809,"arith_fused":7924558,"arith_generic":715686},"status":"keep","description":"[@inline always] on 11 hot handler helpers: +1.2% json_fused, +5.0% json_generic","timestamp":1774373034,"segment":0}
{"run":14,"commit":"8623200","metric":4742033,"metrics":{"json_generic":835223,"csv_fused":3567606,"csv_generic":1533025,"arith_fused":7301135,"arith_generic":684097},"status":"discard","description":"Over-inlining fused_sep_take+end_of_input+take: code bloat hurts icache, -7%","timestamp":1774373084,"segment":0}
{"run":15,"commit":"8623200","metric":4736530,"metrics":{"json_generic":873187,"csv_fused":3601008,"csv_generic":1449990,"arith_fused":7425834,"arith_generic":702526},"status":"discard","description":"[@inline never] compose_branch_errors + [@inline always] pos_of_exn: worse (-7%)","timestamp":1774373122,"segment":0}
{"run":16,"commit":"abf72cd","metric":5075369,"metrics":{"json_generic":904466,"csv_fused":3301093,"csv_generic":1416481,"arith_fused":6961364,"arith_generic":616576},"status":"keep","description":"Reorder effect arms (hot first) + static unreachable_exn: within noise but cleaner code, no regression","timestamp":1774373223,"segment":0}
{"run":17,"commit":"abf72cd","metric":5156899,"metrics":{"json_generic":908443,"csv_fused":3562967,"csv_generic":1585741,"arith_fused":4375793,"arith_generic":587948},"status":"discard","description":"-inline-max-depth 3: json_fused slightly better but arith_fused catastrophically worse (-45%)","timestamp":1774373260,"segment":0}
{"run":18,"commit":"abf72cd","metric":4807692,"metrics":{"json_generic":876497,"csv_fused":3633259,"csv_generic":1417635,"arith_fused":6183145,"arith_generic":666611},"status":"discard","description":"-inline-max-unroll 2: worse across the board, unrolling not useful here","timestamp":1774373289,"segment":0}
{"run":19,"commit":"abf72cd","metric":4754886,"metrics":{"json_generic":927571,"csv_fused":3591890,"csv_generic":1537965,"arith_fused":8074609,"arith_generic":689460},"status":"discard","description":"Skip_char_skip fused effect: saving 1 round-trip not worth the extra match arm overhead (-6.3%)","timestamp":1774373483,"segment":0}
{"run":20,"commit":"abf72cd","metric":4897519,"metrics":{"json_generic":915919,"csv_fused":3809016,"csv_generic":1624933,"arith_fused":8104056,"arith_generic":708569},"status":"discard","description":"[@inline never] on handle_location+handle_match_regex: worse, compiler already handles these correctly","timestamp":1774373564,"segment":0}
{"run":21,"commit":"abf72cd","metric":5046172,"metrics":{"json_generic":912342,"csv_fused":3586865,"csv_generic":1529602,"arith_fused":7697933,"arith_generic":696898},"status":"discard","description":"[@inline always] on combinator functions: within noise, no improvement","timestamp":1774373649,"segment":0}
{"run":22,"commit":"a2df466","metric":5303633,"metrics":{"json_generic":899252,"csv_fused":3876495,"csv_generic":1509981,"arith_fused":8059641,"arith_generic":704106},"status":"keep","description":"Specialize handle_sep_by_take_span: eliminate fn closure call in hot loop. +4.0% json_fused, +7.5% csv_fused","timestamp":1774373777,"segment":0}
{"run":23,"commit":"39c3885","metric":5312649,"metrics":{"json_generic":902161,"csv_fused":3979387,"csv_generic":1479717,"arith_fused":8279174,"arith_generic":679223},"status":"keep","description":"Specialize handle_sep_by_take (string) + remove dead handle_sep_by_take_core: cleaner code, same perf","timestamp":1774373841,"segment":0}
{"run":24,"commit":"39c3885","metric":4852484,"metrics":{"json_generic":940836,"csv_fused":3622860,"csv_generic":1635992,"arith_fused":7568304,"arith_generic":708145},"status":"discard","description":"Array-based sep_by_take_span: worse (-9%), Array.make 16 is expensive for small lists","timestamp":1774373887,"segment":0}
{"run":25,"commit":"39c3885","metric":5351600,"metrics":{"json_generic":874088,"csv_fused":3929582,"csv_generic":1451063,"arith_fused":7920165,"arith_generic":693748},"status":"discard","description":"Local rev_list: within noise of List.rev, no clear improvement","timestamp":1774373925,"segment":0}
{"run":26,"commit":"0ed14a6","metric":5352030,"metrics":{"json_generic":911577,"csv_fused":3842754,"csv_generic":1530550,"arith_fused":8307028,"arith_generic":685904},"status":"keep","description":"Reduce refs in Greedy_many: stack locals vs refs, +0.7% json_fused, cleaner code","timestamp":1774374006,"segment":0}
{"run":27,"commit":"0526333","metric":5180944,"metrics":{"json_generic":853049,"csv_fused":3891278,"csv_generic":1581090,"arith_fused":7964637,"arith_generic":701649},"status":"discard","description":"[@specialise] on go: within noise, no clear improvement","timestamp":1774374189,"segment":0}
{"run":28,"commit":"855beb1","metric":5318442,"metrics":{"json_generic":896789,"csv_fused":3709130,"csv_generic":1517808,"arith_fused":8054772,"arith_generic":700187},"status":"discard","description":"[@inline] on parse: cross-module boundary prevents inlining, within noise","timestamp":1774374244,"segment":0}
{"run":29,"commit":"d323b10","metric":5232315,"metrics":{"json_generic":884099,"csv_fused":3724464,"csv_generic":1660785,"arith_fused":7973528,"arith_generic":663790},"status":"discard","description":"-linscan register allocator: within noise, no consistent improvement","timestamp":1774374392,"segment":0}
{"run":30,"commit":"b94bb06","metric":5127153,"metrics":{"json_generic":910821,"csv_fused":3796723,"csv_generic":1573416,"arith_fused":7403843,"arith_generic":697666},"status":"discard","description":"-function-sections: no improvement, hot code is all in one function","timestamp":1774374468,"segment":0}
{"run":31,"commit":"c36e754","metric":5364087,"metrics":{"json_generic":922501,"csv_fused":3937473,"csv_generic":1557778,"arith_fused":8147303,"arith_generic":700886},"status":"discard","description":"-unsafe: slight improvement but unsafe for production, not keeping","timestamp":1774374549,"segment":0}
{"run":32,"commit":"b2c2dda","metric":5591747,"metrics":{"json_generic":912151,"csv_fused":3923107,"csv_generic":1482503,"arith_fused":8160934,"arith_generic":930873},"status":"keep","description":"O8: Deferred error formatting via Obj.magic — avoid format_error_msg on backtracking. +17.2% json_fused, +37.1% arith_generic","timestamp":1774374869,"segment":0}
{"run":33,"commit":"1f48b3d","metric":3204615,"metrics":{"json_generic":495111,"csv_fused":2750540,"csv_generic":729049,"arith_fused":3699456,"arith_generic":498828},"status":"discard","description":"Shallow handlers (Effect.Shallow): -43% — effc closure+Some alloc per effect dominates. Deep handler syntax is much cheaper.","timestamp":1774377986,"segment":0}
{"run":34,"commit":"1f48b3d","metric":5320564,"metrics":{"json_generic":885559,"csv_fused":3649901,"csv_generic":1521699,"arith_fused":7561723,"arith_generic":932618},"status":"discard","description":"go_direct (no Ok/Error boxing): within noise. Ok v is 2-word minor alloc — too cheap to matter. Exception overhead offsets.","timestamp":1774378162,"segment":0}
{"run":35,"commit":"1f48b3d","metric":5494355,"metrics":{"json_generic":939611,"csv_fused":3861675,"csv_generic":1475307,"arith_fused":8224022,"arith_generic":919794},"status":"discard","description":"[@inline always] compose_branch_errors: within noise, inlining a cold error path doesn't help.","timestamp":1774378213,"segment":0}
{"run":36,"commit":"5b8f70a","metric":3925340,"metrics":{"json_generic":949190,"csv_fused":3682156,"csv_generic":1565889,"arith_fused":7748935,"arith_generic":917819},"status":"discard","description":"Pre-allocated cached state: -30% — prevents register allocation. Local alloc is better for codegen.","timestamp":1774378431,"segment":0}
{"run":37,"commit":"5b8f70a","metric":5504941,"metrics":{"json_generic":953512,"csv_fused":3376553,"csv_generic":1620115,"arith_fused":8023750,"arith_generic":891683},"status":"discard","description":"Sentinel Error (avoid alloc on backtrack): within noise. Error record is 5 words on minor heap — too cheap to matter.","timestamp":1774378596,"segment":0}
